{
  "target": {
    "plugin": "skill-intake",
    "skill": "run-intake-finalize",
    "skill_md_sha256": "e95b7fef9c1a3ddc00a8c7f6453e5d9bf94af875370873bd7f6b0caf4db2b242"
  },
  "review_kind": "elegance",
  "verdict": "PASS",
  "reviewer": "elegant-improvement-executor",
  "reviewed_at": "2026-06-06T10:50:18Z",
  "findings_summary": {
    "contradiction": 1,
    "omission": 1,
    "inconsistency": 2,
    "dependency_break": 1,
    "smell": 0
  },
  "iterations": 1,
  "human_review_required": false,
  "notes": "elegance 4 条件で検証。修正前に high (blocking) 4 件を実コード二段確認で確定し最小差分で修正済。(1) dependency_break/omission: SKILL.md と references/validation-flow.md が呼ぶ `build-intake-final-context.py` が plugins/skill-intake/scripts/ に不在で実行不能 → 実在経路 (render-intake-final.py <output_dir> → convert_md_to_json.py) に書換。(2) inconsistency: render-intake-final.py の実 CLI は `<output_dir>` 1 引数・出力は intake-final.md だが SKILL.md は `--context/--template/--schema/--md-out/--json-out` の架空フラグ CLI を記載 → 実装準拠の起動例に修正。(3) contradiction/inconsistency: cross_check.py の usage は `<intake.md> <intake.json>` (md 先) だが SKILL.md は `intake.json intake.md` の逆順 → 引数順を修正し補足を追記。完全性: Goal/Why/Checklist/入出力契約/検証が整合し欠落なし。一貫性: frontmatter allowed-tools(Read/Write/Bash) と本文・prompts/R1-main.md・schemas/output.schema.json・workflow-manifest.json(P1-P4) 相互整合を確認、prompts/R1-main.md パス参照も修正済 (本 PR 差分)。深度: 具体値直書きリーク無、template/schema は Phase C 移管前の既知債務として SKILL.md Gotchas に明文化済 (意図的・非 blocking)、aggregator SKILL.md / 単一発火点アンカー / template.tmpl の実在を確認。簡潔性: SSOT 二重定義無し、単一発火点定義は aggregator へ参照委譲。修正後 4 script の実在と usage 一致を実行検証 (exit/usage 確認) で確認、build-intake-final-context 残存参照 0 件。changed_paths=[SKILL.md, references/validation-flow.md]。"
}
