{
  "target": {
    "plugin": "skill-intake",
    "skill": "run-intake-kickoff",
    "skill_md_sha256": "a8899ae72dc2960d3040e2bb34f382a933532b4287605b44b742b4e2b775e615"
  },
  "review_kind": "elegance",
  "verdict": "PASS",
  "reviewer": "elegant-improvement-executor",
  "reviewed_at": "2026-06-06T10:50:17Z",
  "findings_summary": {
    "contradiction": 0,
    "omission": 0,
    "inconsistency": 0,
    "dependency_break": 0,
    "smell": 0
  },
  "iterations": 1,
  "human_review_required": false,
  "notes": "30思考法x4条件で検証。修正前に dependency_break 2件(high)を検出・修正済。(1) validate-kickoff-json.py の REQUIRED は timestamp 必須だが output.schema.json は timestamp を required にも properties にも持たず additionalProperties:false。(2) SKILL/prompts は qa_log[] 保存を完了条件とするが schema に qa_log 未定義。両者により script PASS と schema valid を同時に満たす kickoff.json が構造的に存在せず、完了条件(両 exit 0)を充足不能だった。実機検証(jsonschema Draft7 + validate-kickoff-json.py)で破綻を実証。最小差分で schema に timestamp(required) と qa_log(任意, question/answer) を追加し、SKILL 出力例にも qa_log を追記。再検証で script exit 0 かつ schema valid、timestamp 欠落は schema が reject(script と整合)を確認。残る一貫性: allowed-tools(AskUserQuestion) と本文/prompts L3.2、pattern E の扱い(Key Rules6/Gotchas3/Checklist)、output/<hint> パス、いずれも整合。簡潔性: SKILL Checklist と prompts L5.3 の重複は SKILL=人間可読サマリ/prompt=LLM実行契約の二層分離による意図的構造で SSOT 違反ではない。深度: skill_name_hint の固有名詞抽象化(variable_abstraction)と pattern E 確定不能ケースを考慮済。修正後の残課題なし。"
}
