{
  "target": {
    "plugin": "contract-generator",
    "skill": "run-contract-finalize",
    "skill_md_sha256": "a09f0130c0b567122e6aa8f645676ffa159e8d2695dc83c529b722ad4c8b7ccc"
  },
  "review_kind": "elegance",
  "verdict": "PASS",
  "findings_summary": {
    "contradiction": 1,
    "omission": 0,
    "inconsistency": 0,
    "dependency_break": 0,
    "smell": 1
  },
  "reviewer": "elegant-improvement-executor",
  "reviewed_at": "2026-06-01T00:00:00Z",
  "iterations": 2,
  "human_review_required": false,
  "notes": "30思考法×4条件(C1簡潔/C2自己説明/C3一貫/C4検証)で評価。C3一貫性に明確な矛盾1件: prompt SSOT R1 の L1.1不変ルール/L2.1状態遷移が旧push型(Slack承認ゲート必須・draft→approved→completed順序厳守)のまま残存し、中核設計のpull型(発火=Claude Code実行のみ、finalizeがdraftを直接確定、approvedは任意)とSKILL.md/L5/L6/finalize.pyに正面衝突(M5不変条件/M6対称性/M15不変量/M22単一真実源)。iter1でprompt L1.1とL2.1の4行のみ最小差分修正しpull型へ整合(approved経路は後方互換の任意として明示)。残smell1件: 正負フィードバック表がSKILL.mdとprompt L4.4で重複(M28 DRY)だが概要vs L4詳細の漸進的開示範囲内・内容同一で実害なく今回は非改変。agent adapterは要約済みで既にpull型整合のため非改変。C1/C2/C4は良好(SSOT一本化・薄いアダプタ・lib共有・dry-run/台帳観測で検証可能)。"
}
